{"_note":"Fictional sample data for the ql-charts demo. Not real market data.","symbol":"ACME","name":"Acme Robotics (fictional)","prices":[["2021-10-28",58.69],["2021-10-29",59.84],["2021-11-01",59.31],["2021-11-02",58.58],["2021-11-03",59.23],["2021-11-04",59.35],["2021-11-05",58.94],["2021-11-08",59.65],["2021-11-09",60.37],["2021-11-10",60.53],["2021-11-11",61.07],["2021-11-12",61.49],["2021-11-15",62.4],["2021-11-16",61.72],["2021-11-17",61.41],["2021-11-18",62.03],["2021-11-19",62.62],["2021-11-22",61.41],["2021-11-23",61.96],["2021-11-24",61.91],["2021-11-25",63.13],["2021-11-26",64.05],["2021-11-29",63],["2021-11-30",63.08],["2021-12-01",64.33],["2021-12-02",64.91],["2021-12-03",65.38],["2021-12-06",65.65],["2021-12-07",66.91],["2021-12-08",68.19],["2021-12-09",67.84],["2021-12-10",67.38],["2021-12-13",68.45],["2021-12-14",67.98],["2021-12-15",66.96],["2021-12-16",66.4],["2021-12-17",66.23],["2021-12-20",65.66],["2021-12-21",67],["2021-12-22",67.22],["2021-12-23",67.96],["2021-12-24",69.16],["2021-12-27",67.83],["2021-12-28",67.19],["2021-12-29",67.42],["2021-12-30",67.49],["2021-12-31",67.29],["2022-01-03",66.41],["2022-01-04",67.68],["2022-01-05",66.37],["2022-01-06",66.01],["2022-01-07",65.59],["2022-01-10",66.12],["2022-01-11",67.43],["2022-01-12",67.52],["2022-01-13",66.55],["2022-01-14",66.31],["2022-01-17",65.71],["2022-01-18",65.35],["2022-01-19",65.17],["2022-01-20",64.73],["2022-01-21",64.86],["2022-01-24",65.24],["2022-01-25",64.5],["2022-01-26",65.72],["2022-01-27",65.64],["2022-01-28",66.76],["2022-01-31",67.21],["2022-02-01",67.66],["2022-02-02",67.76],["2022-02-03",67.82],["2022-02-04",68.44],["2022-02-07",69.84],["2022-02-08",69.56],["2022-02-09",70.26],["2022-02-10",69.52],["2022-02-11",69.84],["2022-02-14",69.42],["2022-02-15",68.94],["2022-02-16",68.65],["2022-02-17",69.6],["2022-02-18",70.83],["2022-02-21",69.64],["2022-02-22",70.69],["2022-02-23",69.39],["2022-02-24",69.15],["2022-02-25",68.12],["2022-02-28",66.87],["2022-03-01",68.41],["2022-03-02",67.59],["2022-03-03",68.04],["2022-03-04",67],["2022-03-07",66.91],["2022-03-08",67.24],["2022-03-09",66.19],["2022-03-10",67.49],["2022-03-11",68.7],["2022-03-14",69.96],["2022-03-15",71.22],["2022-03-16",72.57],["2022-03-17",73.47],["2022-03-18",72.78],["2022-03-21",71.22],["2022-03-22",70.47],["2022-03-23",69.17],["2022-03-24",67.66],["2022-03-25",68.07],["2022-03-28",67.29],["2022-03-29",68.07],["2022-03-30",68.08],["2022-03-31",68.7],["2022-04-01",67.94],["2022-04-04",69.15],["2022-04-05",68.37],["2022-04-06",68.03],["2022-04-07",69.28],["2022-04-08",68.14],["2022-04-11",68.15],["2022-04-12",66.67],["2022-04-13",67.96],["2022-04-14",68.42],["2022-04-15",69.77],["2022-04-18",68.31],["2022-04-19",69.59],["2022-04-20",68.66],["2022-04-21",70.15],["2022-04-22",70.41],["2022-04-25",71.02],["2022-04-26",70.32],["2022-04-27",69.49],["2022-04-28",68.63],["2022-04-29",68.88],["2022-05-02",67.53],["2022-05-03",68.4],["2022-05-04",69.06],["2022-05-05",69.78],["2022-05-06",69.82],["2022-05-09",68.4],["2022-05-10",67.24],["2022-05-11",68.56],["2022-05-12",67.46],["2022-05-13",68.08],["2022-05-16",69.33],["2022-05-17",67.93],["2022-05-18",69.15],["2022-05-19",70.32],["2022-05-20",71.93],["2022-05-23",73.45],["2022-05-24",74.37],["2022-05-25",74.15],["2022-05-26",73.36],["2022-05-27",74.16],["2022-05-30",75.49],["2022-05-31",75.19],["2022-06-01",74.35],["2022-06-02",74.08],["2022-06-03",75.42],["2022-06-06",75.67],["2022-06-07",75.21],["2022-06-08",75.68],["2022-06-09",76.53],["2022-06-10",76.01],["2022-06-13",76.83],["2022-06-14",76.62],["2022-06-15",75.63],["2022-06-16",75.04],["2022-06-17",76.73],["2022-06-20",78.49],["2022-06-21",79.01],["2022-06-22",80.39],["2022-06-23",81.95],["2022-06-24",80.9],["2022-06-27",81.48],["2022-06-28",80.2],["2022-06-29",80.25],["2022-06-30",80.51],["2022-07-01",81.55],["2022-07-04",83.24],["2022-07-05",83.23],["2022-07-06",82.11],["2022-07-07",81.97],["2022-07-08",80.79],["2022-07-11",81.44],["2022-07-12",81.57],["2022-07-13",81.85],["2022-07-14",81.93],["2022-07-15",82.94],["2022-07-18",82.48],["2022-07-19",83.47],["2022-07-20",81.74],["2022-07-21",81.06],["2022-07-22",81.26],["2022-07-25",80.23],["2022-07-26",81.09],["2022-07-27",80.38],["2022-07-28",79.48],["2022-07-29",80.11],["2022-08-01",79.9],["2022-08-02",78.43],["2022-08-03",79.45],["2022-08-04",80.65],["2022-08-05",82.22],["2022-08-08",83.79],["2022-08-09",84.53],["2022-08-10",86.33],["2022-08-11",84.54],["2022-08-12",85.6],["2022-08-15",86.05],["2022-08-16",86.97],["2022-08-17",88.59],["2022-08-18",86.8],["2022-08-19",85.44],["2022-08-22",83.88],["2022-08-23",82.46],["2022-08-24",80.98],["2022-08-25",79.24],["2022-08-26",79.67],["2022-08-29",81.32],["2022-08-30",80.25],["2022-08-31",78.98],["2022-09-01",77.98],["2022-09-02",78.64],["2022-09-05",77.79],["2022-09-06",77.69],["2022-09-07",79.47],["2022-09-08",79.24],["2022-09-09",79.92],["2022-09-12",80.96],["2022-09-13",80.64],["2022-09-14",80.39],["2022-09-15",78.85],["2022-09-16",77.95],["2022-09-19",79.08],["2022-09-20",80.82],["2022-09-21",79.61],["2022-09-22",81.19],["2022-09-23",81.28],["2022-09-26",79.95],["2022-09-27",78.96],["2022-09-28",79.38],["2022-09-29",78.26],["2022-09-30",76.82],["2022-10-03",76.09],["2022-10-04",76.64],["2022-10-05",76.89],["2022-10-06",76.87],["2022-10-07",78.63],["2022-10-10",77.18],["2022-10-11",76.93],["2022-10-12",76.34],["2022-10-13",74.69],["2022-10-14",73.08],["2022-10-17",72.85],["2022-10-18",71.56],["2022-10-19",70.75],["2022-10-20",72.15],["2022-10-21",73.1],["2022-10-24",74.01],["2022-10-25",73.85],["2022-10-26",75.08],["2022-10-27",76.7],["2022-10-28",77.79],["2022-10-31",78.41],["2022-11-01",78.71],["2022-11-02",78.23],["2022-11-03",77.95],["2022-11-04",78],["2022-11-07",78.03],["2022-11-08",78.32],["2022-11-09",79.15],["2022-11-10",79.8],["2022-11-11",80.33],["2022-11-14",81.21],["2022-11-15",82.67],["2022-11-16",84.01],["2022-11-17",85.91],["2022-11-18",85.73],["2022-11-21",85.74],["2022-11-22",87.56],["2022-11-23",89.49],["2022-11-24",88.98],["2022-11-25",87.35],["2022-11-28",86.79],["2022-11-29",88.35],["2022-11-30",89.24],["2022-12-01",90.25],["2022-12-02",92.16],["2022-12-05",93.41],["2022-12-06",92.25],["2022-12-07",91.22],["2022-12-08",92.51],["2022-12-09",90.92],["2022-12-12",92.68],["2022-12-13",94],["2022-12-14",94.63],["2022-12-15",95.6],["2022-12-16",95.82],["2022-12-19",95.64],["2022-12-20",97.3],["2022-12-21",97.65],["2022-12-22",99.35],["2022-12-23",98.39],["2022-12-26",99.29],["2022-12-27",99.06],["2022-12-28",98.66],["2022-12-29",97.34],["2022-12-30",97.79],["2023-01-02",96.68],["2023-01-03",98.48],["2023-01-04",99.97],["2023-01-05",99.31],["2023-01-06",100.19],["2023-01-09",101.96],["2023-01-10",100.27],["2023-01-11",99.47],["2023-01-12",101.42],["2023-01-13",99.21],["2023-01-16",97.64],["2023-01-17",97.25],["2023-01-18",95.22],["2023-01-19",96.11],["2023-01-20",97.9],["2023-01-23",96.53],["2023-01-24",95.34],["2023-01-25",97.32],["2023-01-26",98.26],["2023-01-27",96.89],["2023-01-30",95.29],["2023-01-31",95.9],["2023-02-01",93.87],["2023-02-02",95.25],["2023-02-03",95.71],["2023-02-06",96.86],["2023-02-07",95.3],["2023-02-08",94.64],["2023-02-09",95.62],["2023-02-10",97.64],["2023-02-13",97.92],["2023-02-14",98.37],["2023-02-15",99.67],["2023-02-16",100.64],["2023-02-17",101.77],["2023-02-20",102.28],["2023-02-21",100.51],["2023-02-22",98.53],["2023-02-23",99.09],["2023-02-24",97.93],["2023-02-27",98.36],["2023-02-28",97.32],["2023-03-01",96.17],["2023-03-02",96.76],["2023-03-03",97.39],["2023-03-06",98.82],["2023-03-07",97.73],["2023-03-08",99.58],["2023-03-09",97.65],["2023-03-10",98.55],["2023-03-13",98.2],["2023-03-14",99.56],["2023-03-15",100.34],["2023-03-16",101.78],["2023-03-17",100.04],["2023-03-20",102],["2023-03-21",102.07],["2023-03-22",103.62],["2023-03-23",103.34],["2023-03-24",105.12],["2023-03-27",106.56],["2023-03-28",107.72],["2023-03-29",109.77],["2023-03-30",111.62],["2023-03-31",110.14],["2023-04-03",111.3],["2023-04-04",109.64],["2023-04-05",107.87],["2023-04-06",110.12],["2023-04-07",112.45],["2023-04-10",110.28],["2023-04-11",108.25],["2023-04-12",107.17],["2023-04-13",109.37],["2023-04-14",111.26],["2023-04-17",113.62],["2023-04-18",112.56],["2023-04-19",111.1],["2023-04-20",108.83],["2023-04-21",108.75],["2023-04-24",109.12],["2023-04-25",107.43],["2023-04-26",106.65],["2023-04-27",106.63],["2023-04-28",105.39],["2023-05-01",103.35],["2023-05-02",101.3],["2023-05-03",99.52],["2023-05-04",100.16],["2023-05-05",100.09],["2023-05-08",101.54],["2023-05-09",102.65],["2023-05-10",102.77],["2023-05-11",103.77],["2023-05-12",103.32],["2023-05-15",103.91],["2023-05-16",106.16],["2023-05-17",107.52],["2023-05-18",109.83],["2023-05-19",110.95],["2023-05-22",111.54],["2023-05-23",113.14],["2023-05-24",111.54],["2023-05-25",109.43],["2023-05-26",110.62],["2023-05-29",111.43],["2023-05-30",111.16],["2023-05-31",111.46],["2023-06-01",110.96],["2023-06-02",111.01],["2023-06-05",109.2],["2023-06-06",107.14],["2023-06-07",105.18],["2023-06-08",104.57],["2023-06-09",103.9],["2023-06-12",102.57],["2023-06-13",103.29],["2023-06-14",101.62],["2023-06-15",99.64],["2023-06-16",97.47],["2023-06-19",99.01],["2023-06-20",100.72],["2023-06-21",98.72],["2023-06-22",99.98],["2023-06-23",99.23],["2023-06-26",98.86],["2023-06-27",100.75],["2023-06-28",102.16],["2023-06-29",99.98],["2023-06-30",102.27],["2023-07-03",100.98],["2023-07-04",101.7],["2023-07-05",101.44],["2023-07-06",99.38],["2023-07-07",97.98],["2023-07-10",99.17],["2023-07-11",100.37],["2023-07-12",99.31],["2023-07-13",100.97],["2023-07-14",102.46],["2023-07-17",101.69],["2023-07-18",101.57],["2023-07-19",100.72],["2023-07-20",99.67],["2023-07-21",101.45],["2023-07-24",103.21],["2023-07-25",104.11],["2023-07-26",104.17],["2023-07-27",105.96],["2023-07-28",107.56],["2023-07-31",109.14],["2023-08-01",110.5],["2023-08-02",112.91],["2023-08-03",113.96],["2023-08-04",112.94],["2023-08-07",114.09],["2023-08-08",113.27],["2023-08-09",115.2],["2023-08-10",113.53],["2023-08-11",115.37]